<?xml version="1.0" encoding="UTF-8"?>
<xsd:schema xmlns:xsd="http://www.w3.org/2001/XMLSchema">
	<xsd:element name="Person">
		<xsd:complexType>
			<xsd:sequence>
			   <xsd:element name="name" type="NameType"/>
               <xsd:element name="degree">
                    <xsd:simpleType>
                        <xsd:restriction base="xsd:string">
                           <xsd:minLength value='2'/>
                           <xsd:maxLength value='2'/>
                        </xsd:restriction>
                    </xsd:simpleType>
               </xsd:element>
               <xsd:element name="class">
                   <xsd:simpleType>
                       <xsd:restriction base="xsd:string">
                          <xsd:minLength value='2'/>
                          <xsd:maxLength value='2'/>
                          <xsd:enumeration value="FR"/>
                          <xsd:enumeration value="SO"/>
                          <xsd:enumeration value="JR"/>
                          <xsd:enumeration value="SR"/>
                          <xsd:enumeration value="GR"/>
                       </xsd:restriction>
                   </xsd:simpleType>
               </xsd:element>    
               <xsd:element name="phone">
                   <xsd:simpleType>
                       <xsd:restriction base="xsd:string">
                          <xsd:minLength value='10'/>
                          <xsd:maxLength value='10'/>
                       </xsd:restriction>
                   </xsd:simpleType>
               </xsd:element>
            </xsd:sequence>
            <xsd:attribute name="status" type="xsd:string"/>
            <xsd:attribute name="lastatt" type="xsd:string"/>
		</xsd:complexType>
    </xsd:element>
    <xsd:complexType name="NameType">
		<xsd:sequence>
		     <xsd:element name="last" type="xsd:string"/>
             <xsd:element name="middle" type="xsd:string"/>
		     <xsd:element name="first" type="xsd:string"/>
		</xsd:sequence>
		<xsd:attribute name="lang" type="xsd:string"/>
	</xsd:complexType>
</xsd:schema>

