<?xml version="1.0" encoding="UTF-8"?>

<Person xmlns:xsi="http://www.w3.org/2001/XMLSchema-instance" xsi:noNamespaceSchemaLocation="person.xsd" status="Dropped" lastatt="2003-06-15">
	<name lang="EN">
		<last>Absher</last>
        <middle>Ray</middle>
		<first>James</first>
	</name>
    <degree>MC</degree>
    <class>JR</class>
    <phone>6158981234</phone>
</Person>

