<?xml version="1.0" encoding="UTF-8"?>

<Person xmlns:xsi="http://www.w3.org/2001/XMLSchema-instance" xsi:noNamespaceSchemaLocation="person.xsd" status="Withdrawn" lastatt="2003-06-20">
	<name lang="EN">
		<last>Bray</last>
        <middle>H</middle>
		<first>Thomas</first>
	</name>
    <degree>LA</degree>
    <class>JR</class>
    <phone>9318981235</phone>
</Person>
